{
  "bundle_id": "bundle.1",
  "bundle_digest": "aaaaaaaaaaaaaaaaaaaaaaaaaaaaaaaaaaaaaaaaaaaaaaaaaaaaaaaaaaaaaaaa",
  "need_ref": "need.1",
  "scope_ref": "tenant.synthetic/subject.1",
  "profile_digest": "aaaaaaaaaaaaaaaaaaaaaaaaaaaaaaaaaaaaaaaaaaaaaaaaaaaaaaaaaaaaaaaa",
  "plan_ref": "plan.1",
  "status": "complete",
  "required_coverage": "satisfied",
  "items": [
    {
      "item_id": "item.1",
      "source_ref": "state.work.1",
      "source_revision": "3",
      "evidence_ref": "evidence.1",
      "scope_ref": "tenant.synthetic/subject.1",
      "authority_class": "source_authority",
      "evidence_state": "supported",
      "semantic_key": "current_state",
      "content": "The Work Item is active.",
      "token_count": 7
    }
  ],
  "omissions": [],
  "conflicts": [],
  "retrieval_receipt_refs": [
    "read.1"
  ],
  "issued_at": "2026-09-25T20:00:00Z",
  "expires_at": "2026-09-25T20:05:00Z"
}
